<?xml version="1.0"?>
<cutscene xmlns:xsi="http://www.w3.org/2001/XMLSchema-instance"
    xsi:noNamespaceSchemaLocation="../../../Cutscene.xsd">
    <nodes>
        <n id="n1">
            <if>
                <check-flag flag="QUEST_JEFFERSON_TAKE_PIC" gte="10" />
                <then>
                    <prefab resource="Exploration/SchoolHall/Dynamics/CH_Brooke" target="CH_Brooke" parent="Dynamic" />
                </then>
            </if>
            <cutscene-outcome value="_destroyObject" />
        </n>
    </nodes>
</cutscene>