<?xml version="1.0"?>
<cutscene xmlns:xsi="http://www.w3.org/2001/XMLSchema-instance"
    xsi:noNamespaceSchemaLocation="../../../Cutscene.xsd">
    <nodes>
        <n id="n1">
            <choice>
                <c out="n2"><text>Go to Hallway</text></c>
                <c out="#a"><text>Back</text></c>
            </choice>
        </n>
        <n id="n2">
            <fade-to-black keep="true" />
            <wait time="1" />
            <load stage="hallway-01" spawn="Player Spawn/Art Class" />
        </n>
    </nodes>
</cutscene>