<?xml version="1.0"?>
<cutscene xmlns:xsi="http://www.w3.org/2001/XMLSchema-instance"
    xsi:noNamespaceSchemaLocation="../../../Cutscene.xsd">
    <nodes>
        <n id="root">
            <switch-text check="${Texts.TXT_ARG_0}" text="TXT_TMP_0">
                <case eq="1">A trashcan... Apparently an invisible object for most students in this school...</case>
                <case eq="2">Yet another trashcan...</case>
                <case eq="3">A trashcan... Brings back bad memories...</case>
                <case eq="4">Another trashcan... There are plenty of those around here...</case>
            </switch-text>
            <dlg style="subjective">
                <m>${Texts.TXT_TMP_0}</m>
            </dlg>
            
            <choice>
                <c out="n2-rummage">
                    <check-flag flag="QUEST_KATE_LOCKER" eq="1" />
                    <text>Rummage</text>
                </c>
                <c out="trash-dump">
                    <check-item item="ITM_TRASH" gte="1" />
                    <text>Discard Trash</text>
                </c>
                <c out="trash-get">
                    <check-item item="ITM_TRASH" lte="3" />
                    <text>Collect Trash</text>
                </c>
                <c out="#a"><text>Leave</text></c>
            </choice>
        </n>

        <n id="n2-rummage">
            <fade-to-black mode="to-from" keep="false" />
            <wait time="2" />
            <if>
                <check-flag flag="QUEST_KATE_LOCKER_KEY_LOCATION" eq-str="${Texts.TXT_ARG_0}" />
                <then>
                    <dlg style="subjective">
                        <m>There's a small key in the trash can...</m>
                        <m>It's probably the one used to mess with a locker combination...</m>
                    </dlg>
        
                    <flag name="QUEST_KATE_LOCKER" set="2" />
                    <item name="ITM_LOCKER_KEY" set="1">*LOCKER KEY* FOUND</item>
                    <objective name="OBJ_KateHelpLockerFindKey" completed="true" />
                    <objective name="OBJ_KateHelpLockerOpenLocker" completed="false" />
                </then>
                <else>
                    <dlg style="subjective">
                        <m>Nothing useful here...</m>
                    </dlg>
                </else>
            </if>
        </n>
        
        <n id="trash-dump">
            <fade-to-black keep="false" />
            <wait time="1" />
            <item name="ITM_TRASH" set="0">DISCARDED ALL TRASH</item>
            <dlg style="subjective">
                <m>Trash is now in the place it belongs...</m>
            </dlg>
        </n>

        <n id="trash-get">
            <fade-to-black keep="false" />
            <wait time="1" />

            <item name="ITM_TRASH" inc="1">Collected trash! Yay!</item>

            <dlg style="subjective">
                <m>Just honing my homeless skills, I guess...</m>
            </dlg>
        </n>
    </nodes>
</cutscene>